College,Department,CourseNumber,Title,Credits,Type,Description,AverageRating
MET,IS,367,"Jobs, Wages, and the Global Economy",4,ONLINE,"This course introduces fundamental concepts of micro and macroeconomics within the context of the labor market. In macroeconomics, we focus on the ability of the economy to create enough jobs to maintain full employment. In microeconomics, we focus on the supply and demand for labor, looking at trends in labor force participation, college attendance, and wage differentials. We will also cover recent topics related to the functioning of the labor market, including a discussion of the effects of the most recent recession, and the employment impact of international trade and outsourcing. Effective Fall 2020, this course fulfills a single unit in each of the following BU Hub areas: Quantitative Reasoning II, Social Inquiry I, Teamwork/Collaboration.",0
MET,IS,370,"China, the Emerging Superpower: A Model for Development?",4,ONLINE,"The course will assess whether China will remain a friend or become a foe for the U.S., argue whether China's road to modernization is an apt model for other developing nations, analyze China's past to discover patterns and traditions that still exist, and study the interaction between China and the world community to determine its future role as a world leader. Effective Fall 2019, this course fulfills a single unit in each of the following BU Hub areas: Historical Consciousness, Global Citizenship and Intercultural Literacy.",0
MET,IS,380,"Landscape, Climate, and Humans",4,ONLINE,"An introduction to environmental science with a dual focus in physical geography and climatology. Interprets major themes in Earth History and human affairs through interactive lessons that include online lectures, outside reading, and extensive online maps, diagrams, and animations. Discusses the interactions of climate, physical geography, and human activities in the formation of a dynamic, living Earth. The action of weather, humans, and non-human organisms on the Earth's surface ties the course together as it concludes with biogeochemistry and a look at the origin of life. Online offering. For further information, please call the Office of Distance Education at 617-358-1960.",0
MET,IS,385,Interior and Exterior Landscapes: Understanding Native American Cultures,4,ONLINE,"The indigenous people of North America have a unique experience of negotiating cultural boundaries, alien ideologies, and inscrutable behaviors that appear in everything from personal interactions to national policy, and their own cultural and religious traditions have survived despite a dominant culture that has sought to both annihilate and romanticize them. This course is about that cultural interaction and offers an opportunity to understand Native American cultures in their own terms through the voices of their people, expressing themselves through literature, film and venues. Effective Fall 2019, this course fulfills a single unit in each of the following BU Hub areas: Global Citizenship and Intercultural Literacy, Writing-Intensive Course, Research and Information Literacy. Prereq: First-Year Writing Seminar",0
MET,IS,403,Natural Science in Contemporary Society,4,HYBRID,"This course will focus on controversial and critical social, environmental, business, and political issues in the various disciplines of science. The natural sciences will be explored in the context of public policy.",0
MET,IS,421,The Art of Rhetoric in Life and Work,4,ONLINE,"The art of rhetoric is one of the original liberal arts and is a part of the trivium that includes grammar and logic. Rhetoric is as old as human communication and as diverse as the human imagination. In the twenty-first century, rhetoric has new forms and meanings but retains some of the dynamics of the classical age of Greece and Rome. This course is a study of the art of rhetoric in everyday life and work from both theoretical and practical perspectives with an emphasis on writing and interpretation. Effective Fall 2019, this course fulfills a single unit in the following BU Hub area: Critical Thinking.",0
MET,IS,460,Romanticism and Its Off-Shoots: Countering the Enlightenment in Philosophical Literature and the Visual Arts,4,ONLINE,"This course explores various currents, paradoxes, and extensions of Romanticism, especially as this movement took shape in Europe and America, with a special focus on philosophical literature and the visual arts. We will begin with some central ideas and themes of German Romantic thinkers, exploring how these ideas and themes are also evoked by British and American writers as well as by European and American painters. We will identify and analyze Romantic themes and styles in early German expressionist films, in British gothic fantasy movies, and in American motion pictures about western front Effective Fall 2019, this course fulfills a single unit in the following BU Hub area: Aesthetic Exploration.",0
MET,LX,250,Introduction to Linguistics,4,IN_PERSON,"Properties that languages share and how languages differ with respect to structure (sound system, word formation, syntax), expression of meaning, acquisition, variation, and change; cultural and artistic uses of language; comparison of oral, written, and signed languages. Effective Fall 2019, this course fulfills a single unit in each of the following BU Hub areas: Scientific Inquiry I, Global Citizenship and Intercultural Literacy, Critical Thinking.",0
MET,LX,501,Phonetics & Phonology: Introduction to Sound Systems,4,IN_PERSON,"Introduction to the nature and patterning of sounds in human language. Presents articulatory and acoustic phonetics, and basic phonological analysis, focusing on cross-language typology and comparison. Hands-on development of practical skills, including IPA transcription, field techniques, and digital speech analysis. Effective Fall 2019, this course fulfills a single unit in each of the following BU Hub areas: Scientific Inquiry II, Quantitative Reasoning I, Critical Thinking. Prereq: (METLX250) or consent of instructor.",0
MET,LX,521,Syntax: Introduction to Sentential Structure,4,IN_PERSON,"Introduction to syntax as an object of inquiry. Students build an increasingly sophisticated model of syntactic knowledge to account for data from English and other languages, constructing and evaluating alternative hypotheses about how sentence structure works. Prereq: (METLX250) or consent of instructor.",0
MET,MA,113,Elementary Statistics,4,IN_PERSON,"Basic concepts of estimation and tests of hypotheses, ideas from probability; one-, two-, and multiple-sample problems. Applications in social sciences. Primarily for students in the social sciences who require a one- semester introduction to statistics, others should consider CAS MA 115 or MA 213. This course fulfills a single unit in the following BU Hub area: Quantitative Reasoning II. MA 113 may not be taken for credit by any student who has completed any MA course numbered 300 or higher. Students may receive credit for not more than one of the following courses: MET MA 113, MA 213, or CAS MA 113, MA 115, or MA 213. ",0
MET,MA,118,College Algebra and Trigonometry,4,IN_PERSON,"Intensive one-semester course in algebra and trigonometry. Prepares students to study calculus. Algebraic operations, word problems, linear and quadratic functions, and identities. Analytic geometry. Exponential and logarithmic functions. MET MA 118 may be taken for CAS credit but does not satisfy the CAS mathematics requirement. Prereq: MET MA 100; or equivalent. Part-time MET students only.",0
MET,MA,120,Applied Mathematics for Social and Management Sciences,4,IN_PERSON,"Linear equations, systems of linear equations, matrix algebra, exponential functions and logarithms, elements of differential calculus, optimization, probability. Applications in economics, finance, and management. Note: MET MA 120 may be taken for CAS credit.",0
MET,MA,123,Calculus I,4,HYBRID,"Limits; derivatives; differentiation of algebraic functions. Applications to maxima, minima, and convexity of functions. The definite integral; the fundamental theorem of integral calculus; applications of integration. Students may receive credit for either MET MA 121 or MA 123 or CAS MA 121 or MA 123, but not both.  Prereq: MET MA 118; or equivalent.",0
MET,MA,123,Calculus I,4,IN_PERSON,"Limits; derivatives; differentiation of algebraic functions. Applications to maxima, minima, and convexity of functions. The definite integral; the fundamental theorem of integral calculus; applications of integration. Students may receive credit for either MET MA 121 or MA 123 or CAS MA 121 or MA 123, but not both.  Prereq: MET MA 118; or equivalent.",0
MET,MA,124,Calculus II,4,IN_PERSON,"Logarithmic, exponential, and trigonometric functions. Sequences and series; Taylor's series with the remainder. Methods of integration. Calculus I and II together constitute an introduction to calculus of a function of a single real variable. Students may receive credit for not more than one of the following courses: MA 122, MA 124, MA 127, or MA 129.  Prereq: Prereq: MET MA 121 or MA 123 or CAS MA 121 or MA 123.",0
MET,MA,213,Basic Statistics and Probability,4,IN_PERSON,"Elementary treatment of probability densities, means, variances, correlation, independence, the binomial distribution, and the central limit theorem. Stresses understanding and theoretical manipulation of statistical concepts. Note: Credit will be given for only one of the following courses: MET MA 113 or MA 213. Prereq: MET MA 118; or equivalent.",0
MET,MA,581,Probability,4,IN_PERSON,"Basic probability, conditional probability, independence. Discrete and continuous random variables, mean and variance, functions of random variables, moment generating function. Jointly distributed random variables, conditional distributions, independent random variables. Methods of transformations, law of large numbers, central limit theorem. Prereq: MET MA 225, or CAS MA 225, or MA 230. Grad Prereq: MET MA 225 or CAS MA 225 or CAS MA 230.",0
MET,MA,603,SAS with Statistical Applications,4,IN_PERSON,"Offers a unified and in-depth coverage of the statistical computer package SAS, and its statistical applications. Topics include the language of SAS, data formatting, creating and storing SAS data sets, file manipulations, macro procedure, and graphics. Also included are procedures for statistical techniques selected from analysis of variance, regression, factor analysis, scoring, and categorical data analysis. Several large data sets will be used as case studies emphasizing hands-on experience with SAS for Windows. Laboratory course. Prereq: MET or CAS MA 214",0
MET,MG,202,Personal Financial Planning,4,IN_PERSON,"The development of personal investment strategies using money and credit. Securities and portfolio management, budgeting, insurance, taxes, retirement programs, and estate planning.",0
MET,MG,315,Operations Management,4,IN_PERSON,"Introduction to the operating functions of a firm. Emphasis on problem-solving skills using analytical techniques. Includes production planning and inventory control, quality control, forecasting, capacity planning, and work-study. Viewed from the aspect of management.",0
MET,MG,410,"Entrepreneurial Management: Starting, Innovating, and Managing Small-, Medium-, and Large-Sized Ventures",4,HYBRID,"Covers the four key elements of successful entrepreneurial management: choosing a business, organizing, financing, and marketing. Includes preparing a business plan, becoming an entrepreneur, raising venture capital, selling, negotiating, and building an effective organization. Topics given special consideration are the practice of innovation, the art of leadership, and how to relate talents to succeeding in an innovative managed venture and technology management.",0
MET,MG,410,"Entrepreneurial Management: Starting, Innovating, and Managing Small-, Medium-, and Large-Sized Ventures",4,IN_PERSON,"Covers the four key elements of successful entrepreneurial management: choosing a business, organizing, financing, and marketing. Includes preparing a business plan, becoming an entrepreneur, raising venture capital, selling, negotiating, and building an effective organization. Topics given special consideration are the practice of innovation, the art of leadership, and how to relate talents to succeeding in an innovative managed venture and technology management.",0
MET,MG,415,Project Management,4,IN_PERSON,"An examination of project management concepts, including organizational forms, planning and control techniques, and the role of the project manager. Develops the skills vital to effective management of multidisciplinary tasks through lectures, case studies, and business simulations. Effective Fall 2020, this course fulfills a single unit in the following BU Hub area: Teamwork/Collaboration.",0
MET,MG,431,International Marketing,4,IN_PERSON,Organization of the marketing function in international business. How government policies and practices affect marketing. Comparative marketing strategies for doing business abroad. Examination of case studies.,0
MET,MG,435,Advertising,4,IN_PERSON,"The structure and operating procedures of advertising agencies and corporate advertising departments in relation to marketing. Active student participation in learning how advertising strategies and concepts are developed and executed. Includes readings, development of advertising strategies, screenings, and analysis of contemporary advertising.",0
MET,MG,448,"Electronic Commerce, Systems, and Web Design",4,IN_PERSON,"The first course in a two course sequence. This course combines (1) the practical aspect of Web design through the use of application software such as Dreamweaver to construct a commercial Web site with (2) a general overview of the marketing, supporting services, systems, security and business strategy issues facing commercial enterprises.",0
MET,MG,472,Financial Concepts,4,IN_PERSON,"Emphasizes issues of accounting, finance, and economics that are important in most management contexts. Introduction to tools of financial analysis and the problems of financial management including cash, profitability, and capital budgeting. Various sources of corporate funds are considered - short-, intermediate-, and long-term arrangements . Stresses understanding financial statements, planning and control, cost and benefit evaluation, cash flow analysis, and capital budgeting. Effective Fall 2020, this course fulfills a single unit in each of the following BU Hub areas: Quantitative Reasoning II, Critical Thinking.",0
MET,MG,473,Quantitative and Qualitative Decision Making,4,IN_PERSON,"This is a basic level course combining the elements of quantitative and qualitative decision making for business. The course exposes the student to practical quantitative approaches to mathematical decision making as well as a wind variety of qualitative approaches for both the services and product industries. Emphasis is placed on the definition of the problem, analysis of the approaches available to solve the problem, an understanding of the limitations and strengths of these approaches as well as the resources necessary. The course additionally prepares the student with design and presentation skills necessary to organize the communications of stating the problem and its different solution or outcome possibilities when the rational for taking a particular course of action needs to be presented to others or the material is being prepared for others who will make business decisions based on the information.",0
MET,MG,503,Business in a Changing Society,4,IN_PERSON,"Examination of the management process and the social environment in which organizations operate, including a discussion of the manager's responsibilities to employees, customers, stockholders, and society. Prereq: Advanced standing or consent of instructor",0
MET,MG,515,Negotiations and Organizational Conflict Resolution,4,HYBRID,"A communications skills course designed to better understand the nature of conflict and its resolution through persuasion, collaboration, and negotiation. Students will learn theories of interpersonal and organizational conflict and its resolution as applied to personal, corporate, historical, and political contexts. Students will assess their own styles, skills, and values, and develop techniques to better resolve disputes, achieve objectives, and exert influence. Grad Prereq: advanced standing or consent of instructor.",0
MET,MG,515,Negotiations and Organizational Conflict Resolution,4,IN_PERSON,"A communications skills course designed to better understand the nature of conflict and its resolution through persuasion, collaboration, and negotiation. Students will learn theories of interpersonal and organizational conflict and its resolution as applied to personal, corporate, historical, and political contexts. Students will assess their own styles, skills, and values, and develop techniques to better resolve disputes, achieve objectives, and exert influence. Grad Prereq: advanced standing or consent of instructor.",0
MET,MG,520,International Business Management,4,IN_PERSON,"Environmental, economic, political, and social constraints on doing business abroad. Examines the effects of overseas business investments on domestic and foreign economics; foreign market analysis and operational strategy of a firm; and development potential of international operations.",0
MET,MG,522,Consumer Behavior,4,IN_PERSON,"A broad view of consumer attitudes, behavior, and decision-making processes. Uses computer and case studies to supplement text readings.",0
MET,MG,530,Business Strategy,4,IN_PERSON,"Policy problems of business organizations. Integrates the areas of marketing, finance, accounting, economics, and personnel into a managerial concept of business decision making.",0
MET,MG,541,The Innovation Process: Developing New Products and Services,4,IN_PERSON,"Addresses the specifics of new product and service development and factors such as market research and partnering that add value and bring innovation to commercial reality. Effective Fall 2020, this course fulfills a single unit in the following BU Hub area: Creativity/Innovation.",0
MET,MG,545,American Institutions and Culture,4,IN_PERSON,"This course is intended primarily for international students to introduce them to American institutions -- business, educational, and political in particular -- within the context of American history, popular culture, and society. Students will learn about the unique features of American management and enterprise. The Boston metropolitan area will play an important role in appreciating the overall historical and cultural context, as will contemporary issues, scholarship, and unfolding events in illustrating distinctive features of American life and commerce.",0
MET,MG,550,International Business Law and Regulation,4,IN_PERSON,"This course examines the international business, legal and regulatory environment. Topics include international legal comparisons, the international sale of goods, imports, and exports, technology transfer, intellectual property protection and forms, and regulations of foreign direct investment.",0
MET,ML,610,Special Topics in Gastronomy,4,IN_PERSON,"ML610 is the designation for Special Topics in Gastronomy. The subject matter for ML610 courses changes from semester to semester, and more than one ML610 can be offered in a given semester. Some of the offerings are listed below.

Race, Ethnicity and Food -- Constructions and experiences of race and ethnicity shape and are shaped by foodways. Both positive and negative definitions of racial and ethnic identities delimit access to and use of different foodstuffs and preparations. In this class we explore these processes, focusing particularly on North America. We will read widely in the literature, paying close attention to intersectional scholarship to understand how limitations related to race, ethnicity, class, religion, gender and sexuality reinforce each other and are also challenged and resisted together. Students will be responsible for participating in and sometimes leading discussion, completing regular writing assignments and designing and completing a semester-long research project.

Sociology of Taste -- Taste has an undeniable personal immediacy: producing visceral feelings ranging from delight to disgust. As a result, in our everyday lives we tend to think about taste as purely a matter of individual preference. However, for sociologists, our tastes are not only socially meaningful, they are also socially determined, organized, and constructed. This course will introduce students to the variety of questions sociologists have asked about taste. What is a need? Where do preferences come from? What social functions might our tastes serve? Major theoretical perspectives for answering these questions will be considered, examining the influence of societal institutions, status seeking behaviors, internalized dispositions, and systems of meaning on not only what we enjoy--but what we find most revolting.",0
MET,ML,611,Archaeology of Food in Ancient Times,4,IN_PERSON,"Examines how people have obtained and processed a wide range of foods through time, beginning with early humans up to early farmers. Topics include food used by hunter/gatherers; changes in diet and nutrition through time. Examines archaeological evidence for types of plants and animals exploited for food, as well as human skeletal evidence for ancient nutrition and diseases related to diet and food stress. Considers early historical periods, especially in terms of how certain foods such as wine have played a significant role in culture beyond basic dietary needs.",0
MET,ML,622,History of Food,4,ONLINE,"History is part of a holistic, interdisciplinary approach to food studies. Our goals in reading history include understanding the ways in which the history of food has shaped our world today and examining ways in which contemporary questions and problems inform historical inquiries. Course readings address some of the ways in which food has influenced human history, particularly at crucial turning points -- for example, the rise of the first civilizations and the European discovery of the Americas. We will also study selected past events and societies through the lens of food and foodways. The topics chosen for the course are presented in thematic and geographic categories, rather than in strict chronological order. The themes are divided among three encompassing meta-themes: Technology & Nature, Mobility, and Culture & Cuisine. These meta-themes will help us to move from the details of our specific weekly topics to their meanings in relationship to larger forces in world history. Students will learn about historical methodology and apply it to their own research.",0
MET,ML,623,Food and Public History,4,IN_PERSON,"Students will examine interpretive foodways programs from museums, living history museums, folklore/folklife programs, culinary tourism offerings, 'historical' food festivals, and food tours to compare different approaches to public histories of food. Through several case studies, students will examine mission statements, interpretive goals, and different methods of communicating with the public. Guest lectures and field trips lay the groundwork for a final project in which students develop a proposal for an interpretive food history program for an area museum, tour program, or public history program. Course offers opportunities for focused inquiry, hands-on research, and creative thinking.",0
MET,ML,625,Wild and Foraged Foods,4,IN_PERSON,"Humans have been foraging for food since prehistoric times, but the recent interest in wild and foraged foods raises interesting issues about our connection to nature amid the panorama of industrially oriented food systems. From political economy to Traditional Ecological Knowledge (TEK), this course explores how we interact with, perceive, and know our world through the procurement of food. Students take part in foraging activities and hands-on culinary labs in order to engage the senses in thinking about the connections between humans, food, and the environment.",0
MET,ML,630,Cookbooks and History,4,IN_PERSON,"What can cookbooks and recipes tell us about an individual? A community? A culture? What does the language of the recipe say about systems of knowledge and ways of thinking about the world? The movement of ingredients and food technology? The transmission of cooking knowledge? Does the analysis of historical cookbooks have contemporary applications? In this course, students will consider these questions through a survey of historical cooking texts and in-class exercises. We will examine cookbooks as a source of culinary history and a window into the changing material culture, practices, spaces, and relationships associated with food preparation and consumption. In addition, students will examine cookbooks and recipes as social documents that reveal the presence of social and economic hierarchies, networks and alliances, and political, economic, and religious structures. We will also examine these documents as cultural texts that reveal the construction of ethnic, gendered, and other identities. Students will study and analyze a selection of cookbooks from different historical periods and geographic regions leading to a final project and paper.",0
