College,Department,CourseNumber,Title,Credits,Type,Description,AverageRating
MET,CS,546,Introduction to Probability and Statistics,4,IN_PERSON,"The goal of this course is to provide students with the mathematical fundamentals required for successful quantitative analysis of problems. The first part of the course introduces the mathematical prerequisites for understanding probability and statistics. Topics include combinatorial mathematics, functions, and the fundamentals of differentiation and integration. The second part of the course concentrates on the study of elementary probability theory, discrete and continuous distributions. Prereq: Academic background that includes the material covered in a standard course on college algebra or instructor's consent. For undergraduate students: This course may not be taken in conjunction with MET MA 113, MET MA 123 or MET MA 213. Only one of these courses can be counted towards degree requirements.",0
MET,CS,546,Introduction to Probability and Statistics,4,ONLINE,"The goal of this course is to provide students with the mathematical fundamentals required for successful quantitative analysis of problems. The first part of the course introduces the mathematical prerequisites for understanding probability and statistics. Topics include combinatorial mathematics, functions, and the fundamentals of differentiation and integration. The second part of the course concentrates on the study of elementary probability theory, discrete and continuous distributions. Prereq: Academic background that includes the material covered in a standard course on college algebra or instructor's consent. For undergraduate students: This course may not be taken in conjunction with MET MA 113, MET MA 123 or MET MA 213. Only one of these courses can be counted towards degree requirements.",0
MET,CS,555,Data Analysis and Visualization with R,4,IN_PERSON,"This course provides an overview of the statistical tools most commonly used to process, analyze, and visualize data. Topics include simple linear regression, multiple regression, logistic regression, analysis of variance, and survival analysis. These topics are explored using the statistical package R, with a focus on understanding how to use and interpret output from this software as well as how to visualize results. In each topic area, the methodology, including underlying assumptions and the mechanics of how it all works along with appropriate interpretation of the results, are discussed. Concepts are presented in context of real world examples. Recommended Prerequisite: MET CS 544 or equivalent knowledge, or instructor's consent.",0
MET,CS,555,Data Analysis and Visualization with R,4,ONLINE,"This course provides an overview of the statistical tools most commonly used to process, analyze, and visualize data. Topics include simple linear regression, multiple regression, logistic regression, analysis of variance, and survival analysis. These topics are explored using the statistical package R, with a focus on understanding how to use and interpret output from this software as well as how to visualize results. In each topic area, the methodology, including underlying assumptions and the mechanics of how it all works along with appropriate interpretation of the results, are discussed. Concepts are presented in context of real world examples. Recommended Prerequisite: MET CS 544 or equivalent knowledge, or instructor's consent.",0
MET,CS,566,Analysis of Algorithms,4,IN_PERSON,"Discusses basic methods for designing and analyzing efficient algorithms emphasizing methods used in practice. Topics include sorting, searching, dynamic programming, greedy algorithms, advanced data structures, graph algorithms (shortest path, spanning trees, tree traversals), matrix operations, string matching, NP completeness. Prereq: MET CS248, and MET CS341 or MET CS342, or instructor's consent.",0
MET,CS,566,Analysis of Algorithms,4,ONLINE,"Discusses basic methods for designing and analyzing efficient algorithms emphasizing methods used in practice. Topics include sorting, searching, dynamic programming, greedy algorithms, advanced data structures, graph algorithms (shortest path, spanning trees, tree traversals), matrix operations, string matching, NP completeness. Prereq: MET CS248, and MET CS341 or MET CS342, or instructor's consent.",0
MET,CS,570,Biomedical Sciences and Health IT,4,ONLINE,"This course is designed for IT professionals, and those training to be IT professionals, who are preparing for careers in healthcare-related IT (Health Informatics). This course provides a high-level introduction into basic concepts of biomedicine and familiarizes students with the structure and organization of American healthcare system and the roles played by IT in that system. The course introduces medical terminology, human anatomy and physiology, disease processes, diagnostic modalities, and treatments associated with common disease processes. IT case studies demonstrate the key roles of health informatics and how IT tools and resources help medical professionals integrate multiple sources of information to make diagnostic and therapeutic decisions.",0
MET,CS,575,Operating Systems,4,IN_PERSON,"Overview of operating system characteristics, design objectives, and structures. Topics include concurrent processes, coordination of asynchronous events, file systems, resource sharing, memory management, security, scheduling and deadlock problems. Prereq: MET CS472, and MET CS231 or MET CS232, or instructor's consent.",0
MET,CS,579,Database Management,4,HYBRID,"This course provides a theoretical yet modern presentation of database topics ranging from Data and Object Modeling, relational algebra and normalization to advanced topics such as how to develop Web-based database applications. Other topics covered - relational data model, SQL and manipulating relational data; applications programming for relational databases; physical characteristics of databases; achieving performance and reliability with database systems; object- oriented database systems. Prereq: MET CS 231 or MET CS 232; or instructor's consent. Restrictions: This course may not be taken in conjunction with MET CS 469 (undergraduate) or MET CS 669. Refer to your Department for further details.",0
MET,CS,579,Database Management,4,IN_PERSON,"This course provides a theoretical yet modern presentation of database topics ranging from Data and Object Modeling, relational algebra and normalization to advanced topics such as how to develop Web-based database applications. Other topics covered - relational data model, SQL and manipulating relational data; applications programming for relational databases; physical characteristics of databases; achieving performance and reliability with database systems; object- oriented database systems. Prereq: MET CS 231 or MET CS 232; or instructor's consent. Restrictions: This course may not be taken in conjunction with MET CS 469 (undergraduate) or MET CS 669. Refer to your Department for further details.",0
MET,CS,580,Health Informatics,4,ONLINE,"This course presents the technological fundamentals and integrated clinical applications of modern Biomedical IT. The first part of the course covers the technological fundamentals and the scientific concepts behind modern medical technologies, such as digital radiography, CT, nuclear medicine, ultrasound imaging, etc. It also presents various medical data and patient records, and focuses on various techniques for processing medical images. This part also covers medical computer networks and systems and data security and protection. The second part of the course focuses on actual medical applications that are used in health care and biomedical research.",0
MET,CS,581,Electronic Health Records,4,HYBRID,"Electronic Health Records (EHRs) are application systems that automate the activities of healthcare clinicians including physicians, nurses, physician assistants, and healthcare administrative staff. Use of EHRs is increasing rapidly due to the systems' benefits and federal government programs to deploy EHRs. This increased use of EHRs has many challenges including complex data, high security requirements, integration to multiple application systems, a distributed user base, and broad impact on how these users work.",0
MET,CS,581,Electronic Health Records,4,IN_PERSON,"Electronic Health Records (EHRs) are application systems that automate the activities of healthcare clinicians including physicians, nurses, physician assistants, and healthcare administrative staff. Use of EHRs is increasing rapidly due to the systems' benefits and federal government programs to deploy EHRs. This increased use of EHRs has many challenges including complex data, high security requirements, integration to multiple application systems, a distributed user base, and broad impact on how these users work.",0
MET,CS,601,Web Application Development,4,IN_PERSON,"This course focuses on building core competencies in web design and development. It begins with a complete immersion into HTML essentially XHTML and Dynamic HTML (DHTML). Students are exposed to Cascading Style Sheets (CSS), as well as Dynamic CSS. The fundamentals of JavaScript language including object-oriented JavaScript is covered comprehensively. AJAX with XML and JSON are covered, as they are the primary means to transfer data from client and server. Prereq: MET CS 200, MET CS 231, MET CS 232 or MET CS 300. Or instructor consent.",0
MET,CS,601,Web Application Development,4,ONLINE,"This course focuses on building core competencies in web design and development. It begins with a complete immersion into HTML essentially XHTML and Dynamic HTML (DHTML). Students are exposed to Cascading Style Sheets (CSS), as well as Dynamic CSS. The fundamentals of JavaScript language including object-oriented JavaScript is covered comprehensively. AJAX with XML and JSON are covered, as they are the primary means to transfer data from client and server. Prereq: MET CS 200, MET CS 231, MET CS 232 or MET CS 300. Or instructor consent.",0
MET,CS,602,Server-Side Web Development,4,IN_PERSON,"The Server-Side Web Development course concentrates primarily on building web applications using PHP/MySQL and Node.js/MongoDB. The course is divided into various modules covering in depth the following topics: PHP, MySQL, Object oriented PHP, PHP MVC, Secure Web applications, Node.js and MongoDB. Along with the fundamentals underlying these technologies, several applications will be showcased as case studies. Students work with these technologies starting with simple applications and then examining real world complex applications. At the end of this course, students would have mastered the web application development on the server-side. Prerequisite: MET CS 601. Or instructor's consent.",0
MET,CS,602,Server-Side Web Development,4,ONLINE,"The Server-Side Web Development course concentrates primarily on building web applications using PHP/MySQL and Node.js/MongoDB. The course is divided into various modules covering in depth the following topics: PHP, MySQL, Object oriented PHP, PHP MVC, Secure Web applications, Node.js and MongoDB. Along with the fundamentals underlying these technologies, several applications will be showcased as case studies. Students work with these technologies starting with simple applications and then examining real world complex applications. At the end of this course, students would have mastered the web application development on the server-side. Prerequisite: MET CS 601. Or instructor's consent.",0
MET,CS,622,Advanced Programming Techniques,4,IN_PERSON,"Polymorphism, containers, libraries, method specifications, large-scale code management, use of exceptions, concurrent programming, functional programming, programming tests. Java will be used to illustrate these concepts. Students will implement a project or projects of their own choosing, in Java, since some concepts are expressible only in Java. Prerequisite: MET CS 342 or equivalent knowledge of Java. Or MET CS 521 and MET CS 526. Or instructor's consent. Effective Fall 2020, this course fulfills a single unit in each of the following BU Hub areas: Quantitative Reasoning II, Creativity/Innovation, Critical Thinking.",0
MET,CS,622,Advanced Programming Techniques,4,ONLINE,"Polymorphism, containers, libraries, method specifications, large-scale code management, use of exceptions, concurrent programming, functional programming, programming tests. Java will be used to illustrate these concepts. Students will implement a project or projects of their own choosing, in Java, since some concepts are expressible only in Java. Prerequisite: MET CS 342 or equivalent knowledge of Java. Or MET CS 521 and MET CS 526. Or instructor's consent. Effective Fall 2020, this course fulfills a single unit in each of the following BU Hub areas: Quantitative Reasoning II, Creativity/Innovation, Critical Thinking.",0
MET,CS,625,Business Data Communication and Networks,4,IN_PERSON,"This course presents the foundations of data communications and takes a bottom-up approach to computer networks. The course concludes with an overview of basic network security and management concepts. Prereq: MET CS 200, or instructor's consent. This course may not be taken in conjunction with MET CS 425 (undergraduate) or MET CS 535. Only one of these courses can be counted towards degree requirements.",0
MET,CS,625,Business Data Communication and Networks,4,ONLINE,"This course presents the foundations of data communications and takes a bottom-up approach to computer networks. The course concludes with an overview of basic network security and management concepts. Prereq: MET CS 200, or instructor's consent. This course may not be taken in conjunction with MET CS 425 (undergraduate) or MET CS 535. Only one of these courses can be counted towards degree requirements.",0
MET,CS,632,Information Technology Project Management,4,IN_PERSON,"This course provides students with a comprehensive overview of the principles, processes, and practices of software project management. Students learn techniques for planning, organizing, scheduling, and controlling software projects. There is substantial focus on software cost estimation and software risk management. Students will obtain practical project management skills and competencies related to the definition of a software project, establishment of project communications, managing project changes, and managing distributed software teams and projects. Effective Fall 2020, this course fulfills a single unit in the following BU Hub area: Teamwork/Collaboration.",0
MET,CS,632,Information Technology Project Management,4,ONLINE,"This course provides students with a comprehensive overview of the principles, processes, and practices of software project management. Students learn techniques for planning, organizing, scheduling, and controlling software projects. There is substantial focus on software cost estimation and software risk management. Students will obtain practical project management skills and competencies related to the definition of a software project, establishment of project communications, managing project changes, and managing distributed software teams and projects. Effective Fall 2020, this course fulfills a single unit in the following BU Hub area: Teamwork/Collaboration.",0
MET,CS,633,"Software Quality, Testing, and Security Management",4,HYBRID,"Theory and practice of security and quality assurance and testing for each step of the software development cycle. Verification vs. validation. Test case design techniques, test coverage criteria, security development and verification practices, and tools for static and dynamic analysis. Standards. Test-driven development. QA for maintenance and legacy applications. From a project management knowledge perspective, this course covers the methods, tools and techniques associated with the following processes -- Plan Quality, Perform Quality Assurance, and Perform Quality Control.",0
MET,CS,633,"Software Quality, Testing, and Security Management",4,IN_PERSON,"Theory and practice of security and quality assurance and testing for each step of the software development cycle. Verification vs. validation. Test case design techniques, test coverage criteria, security development and verification practices, and tools for static and dynamic analysis. Standards. Test-driven development. QA for maintenance and legacy applications. From a project management knowledge perspective, this course covers the methods, tools and techniques associated with the following processes -- Plan Quality, Perform Quality Assurance, and Perform Quality Control.",0
MET,CS,634,Agile Software Development,4,IN_PERSON,"This course provides students with a comprehensive overview of the principles, processes, and practices of agile software development. Students learn techniques for initiating, planning and executing on software development projects using agile methodologies. Students will obtain practical knowledge of agile development frameworks and be able to distinguish between agile and traditional project management methodologies. Students will learn how to apply agile tools and techniques in the software development lifecycle from project ideation to deployment, including establishing an agile team environment, roles and responsibilities, communication and reporting methods, and embracing change. We also leverage the guidelines outlined by the Project Management Institute for agile project development as a framework in this course.",0
MET,CS,634,Agile Software Development,4,ONLINE,"This course provides students with a comprehensive overview of the principles, processes, and practices of agile software development. Students learn techniques for initiating, planning and executing on software development projects using agile methodologies. Students will obtain practical knowledge of agile development frameworks and be able to distinguish between agile and traditional project management methodologies. Students will learn how to apply agile tools and techniques in the software development lifecycle from project ideation to deployment, including establishing an agile team environment, roles and responsibilities, communication and reporting methods, and embracing change. We also leverage the guidelines outlined by the Project Management Institute for agile project development as a framework in this course.",0
MET,CS,662,Computer Language Theory,4,IN_PERSON,"Theory of finite automata and regular expressions and properties of regular sets. Context- free grammars, context-free languages, and pushdown automata. Turing machines, undecidability problems, and the Chomsky hierarchy. Introduction to computational complexity theory and the study of NP-complete problems. Prerequisite: MET CS 248 or instructor's consent.",0
MET,CS,664,Artificial Intelligence,4,IN_PERSON,"Study of the ideas and techniques that enable computers to behave intelligently. Search, constraint propagations, and reasoning. Knowledge representation, natural language, learning, question answering, inference, visual perception, and/or problem solving. Laboratory course. Prereq: MET CS 248 and MET CS 341 or MET CS 342; or instructor's consent.",0
MET,CS,665,Software Design and Patterns,4,IN_PERSON,"Software design principles, the object-oriented paradigm, unified modeling language; creational, structural, and behavioral design patterns; OO analysis and design; implementation of semester project. Laboratory course. Prereq: (MET CS 526 or MET CS 622) and one of the following (MET CS 341, MET CS 342, MET CS 520, or MET CS 521). Or instructor's consent.",0
MET,CS,665,Software Design and Patterns,4,ONLINE,"Software design principles, the object-oriented paradigm, unified modeling language; creational, structural, and behavioral design patterns; OO analysis and design; implementation of semester project. Laboratory course. Prereq: (MET CS 526 or MET CS 622) and one of the following (MET CS 341, MET CS 342, MET CS 520, or MET CS 521). Or instructor's consent.",0
MET,CS,669,Database Design and Implementation for Business,4,HYBRID,"Students learn the latest relational and object-relational tools and techniques for persistent data and object modeling and management. Students gain extensive hands- on experience using Oracle or Microsoft SQL Server as they learn the Structured Query Language (SQL) and design and implement databases. Students design and implement a database system as a term project. Restrictions: This course may not be taken in conjunction with MET CS 469 (undergraduate) or MET CS 579. Only one of these courses can be counted towards degree requirements. Prerequisite: MET CS 200 or MET CS 622. Or, instructor's consent.",0
MET,CS,669,Database Design and Implementation for Business,4,IN_PERSON,"Students learn the latest relational and object-relational tools and techniques for persistent data and object modeling and management. Students gain extensive hands- on experience using Oracle or Microsoft SQL Server as they learn the Structured Query Language (SQL) and design and implement databases. Students design and implement a database system as a term project. Restrictions: This course may not be taken in conjunction with MET CS 469 (undergraduate) or MET CS 579. Only one of these courses can be counted towards degree requirements. Prerequisite: MET CS 200 or MET CS 622. Or, instructor's consent.",0
MET,CS,669,Database Design and Implementation for Business,4,ONLINE,"Students learn the latest relational and object-relational tools and techniques for persistent data and object modeling and management. Students gain extensive hands- on experience using Oracle or Microsoft SQL Server as they learn the Structured Query Language (SQL) and design and implement databases. Students design and implement a database system as a term project. Restrictions: This course may not be taken in conjunction with MET CS 469 (undergraduate) or MET CS 579. Only one of these courses can be counted towards degree requirements. Prerequisite: MET CS 200 or MET CS 622. Or, instructor's consent.",0
MET,CS,673,Software Engineering,4,IN_PERSON,"Overview of techniques and tools to develop high quality software. Topics include software development life cycle such as Agile and DevOps, requirements analysis, software design, programming techniques, refactoring, testing, as well as software management issues. This course features a semester-long group project where students will design and develop a real world software system in groups using Agile methodology and various SE tools, including UML tools, project management tools, programming frameworks, unit and system testing tools , integration tools and version control tools. Prereq: At least two 500 level or above programming intensive courses. Or instructor's consent. Students should be familiar with object oriented design concepts and proficient in at least one high level programming language before taking this class. Effective Fall 2020, this course fulfills a single unit in each of the following BU Hub areas: Digital/Multimedia Expression, Oral and/or Signed Communication, Teamwork/Collaboration.",0
MET,CS,673,Software Engineering,4,ONLINE,"Overview of techniques and tools to develop high quality software. Topics include software development life cycle such as Agile and DevOps, requirements analysis, software design, programming techniques, refactoring, testing, as well as software management issues. This course features a semester-long group project where students will design and develop a real world software system in groups using Agile methodology and various SE tools, including UML tools, project management tools, programming frameworks, unit and system testing tools , integration tools and version control tools. Prereq: At least two 500 level or above programming intensive courses. Or instructor's consent. Students should be familiar with object oriented design concepts and proficient in at least one high level programming language before taking this class. Effective Fall 2020, this course fulfills a single unit in each of the following BU Hub areas: Digital/Multimedia Expression, Oral and/or Signed Communication, Teamwork/Collaboration.",0
MET,CS,674,Database Security,4,HYBRID,"The course provides a strong foundation in database security and auditing. This course utilizes Oracle scenarios and step-by-step examples. The following topics are covered: security, profiles, password policies, privileges and roles, Virtual Private Databases, and auditing. The course also covers advanced topics such as SQL injection, database management security issues such as securing the DBMS, enforcing access controls, and related issues. Prereq: MET CS 579 or MET CS 669; or instructor's consent.",0
MET,CS,674,Database Security,4,IN_PERSON,"The course provides a strong foundation in database security and auditing. This course utilizes Oracle scenarios and step-by-step examples. The following topics are covered: security, profiles, password policies, privileges and roles, Virtual Private Databases, and auditing. The course also covers advanced topics such as SQL injection, database management security issues such as securing the DBMS, enforcing access controls, and related issues. Prereq: MET CS 579 or MET CS 669; or instructor's consent.",0
MET,CS,674,Database Security,4,ONLINE,"The course provides a strong foundation in database security and auditing. This course utilizes Oracle scenarios and step-by-step examples. The following topics are covered: security, profiles, password policies, privileges and roles, Virtual Private Databases, and auditing. The course also covers advanced topics such as SQL injection, database management security issues such as securing the DBMS, enforcing access controls, and related issues. Prereq: MET CS 579 or MET CS 669; or instructor's consent.",0
