College,Department,CourseNumber,Title,Credits,Type,Description,AverageRating
MET,AD,760,International Trade and Logistics,4,ONLINE,"Techniques and procedures for conducting international trade. The course focus is practical. Topics include operations, government agencies and import/export channel networks, and the evaluation of international opportunities. Designed to provide students with the skills and tools necessary for international trade.",0
MET,AD,763,Multinational Finance and Trade,4,IN_PERSON,"Applies the concepts of corporate finance to the problems of multinational financial management. Major topics include private and public institutions, foreign exchange rates, capital flows, speculation, analysis of alternative foreign investments, analysis of sources and uses of corporate funds abroad, multinational tax and profit planning, international risk analysis, and capital budgeting. Prereq: MET AD731",0
MET,AD,763,Multinational Finance and Trade,4,ONLINE,"Applies the concepts of corporate finance to the problems of multinational financial management. Major topics include private and public institutions, foreign exchange rates, capital flows, speculation, analysis of alternative foreign investments, analysis of sources and uses of corporate funds abroad, multinational tax and profit planning, international risk analysis, and capital budgeting. Prereq: MET AD731",0
MET,AD,782,Project Value Strategies,4,IN_PERSON,"This course will introduce students to Project Value -- a unique perspective on classical Project Management that is focused on assuring that a project delivers value that is aligned with the mission, vision, and values of an organization. This increasingly popular framework with which to view projects and project management is derived from current research, standards, and thought leadership from PMI and other international bodies . Students will learn how to create value in projects even in today's disruptive, turbulent environment. They will learn how to apply the conceptual framework of benefits realization management (BRM) and to use tools to manage a portfolio of programs and projects strategically with an aim of sustainable project value. Value in Agile projects will be discussed. The element of the Triple Bottom Line and a focus on sustainability is part of the subject matter. Case studies and real life experiences, illustrated with guest lectures, will be intertwined with current research in project management. Prereq: METAD642",0
MET,AD,804,Capstone Project for Supply Chain Management,4,IN_PERSON,This course is one of the last courses that a student in the supply chain management program is required to take. Students are expected to carry out independent research on a relevant topic in the area of supply chain management under the supervision of the instructor for the course.,0
MET,AD,855,Strategic Advantage,4,HYBRID,"Strategy concerns the long-term direction, scope and performance of an organization within its specific context. While senior managers are normally responsible for strategic planning, the implementation of strategy is most effective if managers at all levels ensure that their actions, performance goals, resource applications, etc. are aligned with the efforts of other functions and departments, and with the major strategic orientation of the firm. This module aims to develop critical understandings and insights about strategy and strategic management at the business unit level.",0
MET,AD,856,Market and Economic Research and Analysis,4,IN_PERSON,"The course is designed to prepare the student to undertake a comprehensive survey of the regional or national economic, social, logistical/infrastructure and attraction market to determine the most appropriate allocation of resources and strategic positioning. Students are exposed to the development of tourism and regional development plan, the basis for segmentation and target markets. The methods and tools of market and economic research are presented and the role/interplay of private, local, national and international intuitions are discussed as they relate to data gathering and plan assessment and implementation.",0
MET,AD,856,Market and Economic Research and Analysis,4,ONLINE,"The course is designed to prepare the student to undertake a comprehensive survey of the regional or national economic, social, logistical/infrastructure and attraction market to determine the most appropriate allocation of resources and strategic positioning. Students are exposed to the development of tourism and regional development plan, the basis for segmentation and target markets. The methods and tools of market and economic research are presented and the role/interplay of private, local, national and international intuitions are discussed as they relate to data gathering and plan assessment and implementation.",0
MET,AH,111,Survey of Western Art I,4,IN_PERSON,"This course examines the history of western art from ancient times through the Gothic Period in Western Europe. Through classroom discussions, assigned readings, and, should time allow, museum visits, students will become familiar with the development of a variety of early forms of art. With each new style or period, we will attempt both to describe the works themselves, and investigate the cultural, social, religious, political and personal contexts that surround the object.",0
MET,AH,216,Basic Digital Photography,4,IN_PERSON,"Extensive practical application in basic aspects of digital photography. This course covers camera operation, image processing in black and white and an introduction to shooting color and color management at the end of the semester and the basics of Photoshop. This class will offer free use of DSLR cameras that can be signed out for all the assignments, and free downloads and use of the software that we will use for the course. Students no longer need to supply their own camera. Students will use their own laptops to edit and produce photos for their assignments in this class. Photoshop and other software needed for the class will be made available to students for little or no fee. Laptops will be used in every class session.",0
MET,AH,315,History of Photography,4,IN_PERSON,"The goal of this course is to understand the history of photographic images, their meaning and impact on society. Photographic images are part of the landscape of our experience. We will examine the development of photography as an art form, a social document and a powerful tool for communication and exploration. Lectures, discussions and museum visits will focus on photographic movements, specific photographers, artists and the intersection of photography with other realms of human endeavor. Students will create images to assist them in understanding the simple and complex dimensions of creating photographs.",0
MET,AH,370,Nineteenth-Century Art,4,IN_PERSON,"An examination of the new concepts of reality that grew out of the French Revolution, and how these concepts influenced the critical theories of Impressionist and Post-Impressionist art.",0
MET,AH,372,Modern Art,4,IN_PERSON,"Analysis of the work and thought of major masters of twentieth-century painting, sculpture, architecture, and photography, including the School of Paris and the New York School.",0
MET,AN,101,Introduction to Cultural Anthropology,4,IN_PERSON,"This course is an introduction to the field of cultural anthropology. Cultural anthropology seeks to understand the variety of ways that humans organize their experience and live in the world, including different configurations of kinship, sex, gender, ethnicity, race, religion, politics, and economics. This course introduces students to some of that variety by examining how societies in different regions of the world differ and how both global and local social processes transform them. The course also explores the ways that anthropologists frame their inquiries and how over time they developed new approaches to these issues and to core concepts like culture and society.",0
MET,AN,102,"Human Biology, Behavior, and Evolution",4,IN_PERSON,"Biology relevant to the behavioral sciences. Introduces basic principles of evolutionary biology, animal social behavior, primate adaptions, human origins, genetic/hormonal/neural bases of behavior, and issues of human socioecology and adaptions. Discussions highlight nature-vs-nurture issues.",0
MET,AR,550,Raising Funds and Grant Writing for Nonprofit Organizations,4,IN_PERSON,"An examination of ways to raise funds from government, foundation, corporate, and individual sources. The following topics will be addressed through lectures and case analysis: the history of philanthropy, the planning and research process, proposal and grant preparation, program evaluation, and the role of the board and staff in developing effective fundraising strategies.",0
MET,AR,550,Raising Funds and Grant Writing for Nonprofit Organizations,4,ONLINE,"An examination of ways to raise funds from government, foundation, corporate, and individual sources. The following topics will be addressed through lectures and case analysis: the history of philanthropy, the planning and research process, proposal and grant preparation, program evaluation, and the role of the board and staff in developing effective fundraising strategies.",0
MET,AR,690,The Art World,4,IN_PERSON,"An examination of the arts institutions, issues, and forces that shape the contemporary art world. Surveys the institutions and actors that comprise the ecology of the art world, and examines significant recent trends within a model of four interrelated spheres: 1) Individuals; 2) Government; 3) the Nonprofit Sector; and 4) the Private Sector. Explores how stakeholders connect and interact with each other while engaging with significant institutions and the public to affect the cultural history of our time. This is the gateway course in the Arts Administration Program, and is usually taken in the first semester. Non-Arts Administration students contact the Arts Administration Program, 1010 Commonwealth Ave.",0
MET,AR,711,Capital Campaigns,4,IN_PERSON,"This course is designed to broaden the student's understanding of capital campaign fundraising. Topics include: feasibility studies; strategic planning and budgeting; private and public phases; ethical responsibilities; staff, donor, volunteer, board, and trustee management; major gift solicitation; campaign communications; trend analysis; and evaluation. The course curriculum includes readings, case studies, guest speakers, and analysis of current capital campaign projects.",0
MET,AR,720,Marketing and Audience Development for the Arts,4,IN_PERSON,This course is designed to provide fundamental background in the theory and principles of arts marketing and audience development used by nonprofit performing and visual arts organizations. Case analysis will be employed to review strategies and practices currently used in the cultural sector. Students will be expected to develop their own marketing plans for an arts organization.,0
MET,AR,722,Educational Programming in Cultural Institutions,4,IN_PERSON,"This course will review the history, theory, and practice of educational programming and audience engagement in both museums and performing arts organizations. Emphasis will be on analysis of program design, implementation, and evaluation, teacher training, and creation of youth and adult learning programs.",0
MET,AR,730,Political and Public Advocacy for the Arts,4,IN_PERSON,"This course will address the politics of arts and culture through seminars with political and cultural leaders, class discussion, readings, and research. Students will develop advocacy campaign plans and analyze how cultural organizations interact with all levels of government.",0
MET,AR,740,Technology and Arts Administration,4,IN_PERSON,"The ever-evolving nature of computer technology presents opportunities and challenges in the work of arts administrators. This course will examine a range of technologies employed by arts organizations to improve their practice and extend their reach, including customer relations management, fundraising, collaboration management, ticketing, project management, and social media management. Students will examine emerging products and trends, interact with technology providers, engage in hands-on trials, and develop technology plans for specific organization scenarios.",0
MET,AR,750,Financial Management for Nonprofits,4,IN_PERSON,"Analyzes issues of accounting, finance, and economics in the context of the nonprofit organization. Stresses understanding financial statements, budget planning and control, cash flow analysis, and long term planning.",0
MET,AR,750,Financial Management for Nonprofits,4,ONLINE,"Analyzes issues of accounting, finance, and economics in the context of the nonprofit organization. Stresses understanding financial statements, budget planning and control, cash flow analysis, and long term planning.",0
MET,AR,751,Commercial Production: The Broadway Model,4,IN_PERSON,"This course will examine the process of developing commercial Broadway productions from 'page to stage.' Students will examine the selection process that producers follow to identify a piece or property. We will examine the entire production process, from securing the rights and options, to legal processes including investor relations and collective bargaining, to assembling a creative and production team. Students will have the opportunity to meet with several Broadway producers as guest speakers. Other topics covered may include securing a theater, residual and subsidiary income as well as domestic and international touring. The leadership role of the producer will be discussed at every stage of the journey.",0
MET,AR,752,Leadership and Entrepreneurship in the Commercial Performing Arts,4,IN_PERSON,"Leadership skills are required at all levels of an entertainment business. Students will examine aspects of leadership within multiple levels of these businesses. Students will be introduced to formal leadership skills and styles with the goal of examining a leader's ability to build a team, manage staff, ideas and projects using skills to 'manage up' and oversee, inspire and lead teams in their supervision. Given many leaders in arts and entertainment hold what are traditionally viewed as management positions, this course will compare and contrast the concepts of both management and leadership.

Through moderated discussions students will examine leadership in multiple levels of a variety representative enterprises. This will include the opportunity to learn from the leadership at the top of an organization and their support teams emphasizing the path leadership takes throughout a successful organization. Representative organizations may include commercial producing and/or presenting organizations, trade organizations, property owners and facility management, service providers or copyright / licensing management. The leadership skills and traits of successful producers and presenters are compared and contrasted in the context of workplace environments and organizational cultures.",0
MET,AR,753,Current Trends in the Performing Arts Industry,4,IN_PERSON,"Promoting a theatrical property extends beyond selling tickets to performances; be it a limited or open-ended engagement. Producers and artists continually seek new opportunities and environments for their properties. This requires strategic planning with a holistic view of an goals implementing a methodical process, of analyzing, decision-making and forecasting its business activity(s) to ensure future success.",0
MET,AR,754,Global Performing Arts Presenting,4,IN_PERSON,"This course focuses on core concepts that are involved with offering a theatrical property to the touring market and other commercial presenting environments such as cruise ships, casinos, resorts or public/private partnerships. Leaders of these businesses and entertainment organizations must present or produce artistically rewarding programs that align with their missions to attract, retain and grow audiences, while maintaining sustainable financial support. The course explores the assessment of a commercial artistic/entertainment property for the purpose of placing the property on Broadway, an international tour or other settings in which the property can be presented and monetized. The specific legal and licensing requirements to accomplish a variety of presenting models, such as ADA requirements, international visa requirements, content licensing, and financial models etc. will be explored with a strong focus on international engagements and viability.",0
MET,AR,766,Arts and the Community,4,IN_PERSON,"An analysis of issues that involve the engagement of cultural institutions with their immediate community. Includes examination of local arts centers, local arts councils, arts service organizations, agency/government relations, urban issues, multiculturalism, and festivals.",0
MET,AR,778,Legal Issues in Arts Administration,4,IN_PERSON,"Arts Administration Law is not a legal field; rather, it is a series of highly specialized legal analyses lying at the intersection of tax, intellectual property, employment, corporate law, and the law of non-profits that defines the legal status and issues of arts organizations. It is an interdisciplinary area, including all aspects of the law connected with art, artists (both performing and visual), performance and objects. Topics include: nonprofits and tax- exemption, contracts, copyright for performing and visual artists and artifacts, artists' moral rights, employment law, cultural heritage and the First Amendment. The course is taught using case studies and the case method applied to legal decisions, to which legal analytic frameworks will be applied. Prerequisite: MET AR690",0
MET,AR,781,Special Topics in Arts Administration,4,IN_PERSON,"AR781 is the designation for Special Topics in Computer Science. The subject matter for AR781 courses changes from semester to semester, and more than one AR781 can be offered in a given semester. Some of the offerings are listed below.

Arts Leadership in Times of Crisis -- The purpose of this course is to explore issues involved in managing an arts organization in a time of crisis, whether the crisis is due to external circumstances or internal dysfunction. Through a combination of case analysis, class discussion, and the insights of guest speakers from the local arts community, we will focus on how organizations can best prepare to survive a crisis situation. Specific topics will include crisis communications and PR, providing programming through alternative channels, human resource management, fundraising and financial impacts, and maintaining connections to the community.

Supporting Global Artists of Tomorrow -- Who will support the future Tamara de Lempicka, Steven McRae, Karin Chein, Susan Sontag, Elizabeth Diller, and Martin Kennedy? How would a local arts center, ballet, arts, or historical museum thrive? This course provides an overview of how philanthropy impacts arts, culture, and future artists in different parts of the world. Since every culture has its expressions of generosity, it results in diverse approaches throughout the globe. This course will examine how various big and small arts organizations use individual giving, community giving, and institutional giving. Drawing on contemporary texts and with input from experts around the globe, students will be engaged in a discussion about the types of philanthropic donors, clarity of mission, styles of management, and the role of organizational leadership around the world.",0
MET,AR,802,Internship in Arts Administration I,2,IN_PERSON,"This course provides provide guidance in identifying, securing, and preparing for your internship experience. There will be three class meetings that operate on a seminar model. Students will have the opportunity to discuss their plans and concerns as they begin the process of identifying an internship site and applying for internships. Class sessions will also include specific instructions on preparation of resumes, job-hunting techniques, effective presentation, and the like. There are two Saturday morning workshops, one devoted to resume preparation (required) and one on making effective presentations (optional but strongly recommended). Arts Administration degree students only.",0
MET,AR,803,Internship in Arts Administration II,2,IN_PERSON,"This course provides guidance to students as they undertake the internship experience. Students will meet individually with the instructor to report on their experience and receive feedback. Students will have the opportunity to share their experiences and 'lessons learned' with their classmates, and to provide advice and guidance to students who are in the planning stages of their own internships. Students may not register for MET AR 803, or begin their actual internship until they have completed a minimum of six of the ten required courses. Arts Administration degree students only.",0
MET,AT,602,Laboratory for Actuarial and Financial Data Analysis II,3,IN_PERSON,This course covers the usage of spreadsheet and database software in an insurance setting. The student will work on calculating premiums and analyzing loss metrics over the term while learning about the tools in Microsoft Excel and Access that help an actuary perform their analysis in a timely and accurate manner. Ten sessions.,0
MET,AT,721,Mathematics of Compound Interest,4,IN_PERSON,"This course develops uses of interest as it relates to the theory of finance. Students will gain an understanding of interest calculations related to financial instruments such as bonds, mortgages, annuities, and financial instruments with non-level payment schemes. The material covered in this course may help students prepare for SoA/CAS Exam FM. Prereq: MET MA 225.",0
MET,AT,722,Finance for Actuaries,4,IN_PERSON,"This course builds off of the topics covered in AT721 ('Mathematics of Compound Interest') by developing both basic and advanced models of corporate finance. Topics covered include net present value valuation, internal rate of return and profitability index models, capital budgeting models, and efficient market hypotheses. These tools will be used to understand and apply basic principles of option pricing theory, including the Black-Scholes formula with application to binomial lattice valuation. The material covered in this course may help students prepare for SoA/CAS Exam FM. Prereq: MET AT 721.",0
MET,AT,732,Actuarial Mathematics II,4,IN_PERSON,"This continues with the development of financial models first introduced in AT731 ('Actuarial Mathematics I'). Insurance Reserves are introduced, including methods for determining reserves, the impact of actuarial assumptions on the calculations, and the effect of real-world results that do not match those assumed. The expands on the material from AT731 by addressing multiple life and multiple decrement functions. The latter part of the course focuses on Multiple State/Markov Chains and pension mathematics. The material covered in this course may help students prepare for SoA Exam LTAM. Prereq: MET AT 731 or consent of instructor. Grad Prereq: MET AT 731 or consent of instructor.",0
MET,AT,741,Actuarial Statistics I,4,IN_PERSON,"This course provides students with the mathematical background to non-life models, such as medical and automobile insurance. Topics covered include severity loss models for claims and frequency models for occurrence of those claims. The severity and frequency models are then brought together, and aggregate models are addressee. During the semester, students are presented with modification to both severity and frequency models including deductibles and claims limits. The course emphasizes applications of statistical principles in actuarial models and modeling. The material covered in this course may help students prepare for SoA Exam STAM and CAS Exam MS II. Prereq: MET MA 582.",0
MET,AT,751,Individual Insurance Applications of Actuarial Principles,4,IN_PERSON,"This course covers the application of basic actuarial principles to individual life and annuity financial security systems. Material covered will include the purpose of these systems, the development of financial security products, risk classification, actuarial pricing assumptions, the calculation of product cash flows, the purpose of reserves and different reserve methods. Taxation, required capital, profit measurement, and reinsurance considerations will also be studied.",0
MET,AT,752,Group Insurance Applications of Actuarial Principles,4,IN_PERSON,"This course covers the application of basic actuarial principles to group life and group health financial security systems. Material covered will include the purpose of these systems, financial security product design and development, underwriting and risk management, premium determination, and the funding and valuation of group life and group health financial security systems. Group systems in the United States will be emphasized, but the course will also review the Canadian health system.",0
MET,AT,762,Mathematical Finance for Actuarial Science,4,IN_PERSON,"This course covers the analysis of derivative products and their use in insurance and risk management strategies. It covers selected aspects of rational valuation of derivative products like put-call parity, binomial option, and Black Scholes option pricing model. Prereq: MET MA 581 and MET AT 721.",0
