College,Department,CourseNumber,Title,Credits,Type,Description,AverageRating
MET,AD,510,Mathematics & Statistics in Management,4,IN_PERSON,The goal of this course is to introduce to students foundational mathematics and statistics knowledge that will provide them skills and tools necessary to succeed in their area of study.,0
MET,AD,510,Mathematics & Statistics in Management,4,ONLINE,The goal of this course is to introduce to students foundational mathematics and statistics knowledge that will provide them skills and tools necessary to succeed in their area of study.,0
MET,AD,571,Business Analytics Foundations,4,IN_PERSON,"This course presents fundamental knowledge and skills for applying business analytics to managerial decision-making in corporate environments. Topics include descriptive analytics (techniques for categorizing, characterizing, consolidation, and classifying data for conversion into useful information for the purposes of understanding and analyzing business performance), predictive analytics (techniques for detection of hidden patterns in large quantities of data to segment and group data into coherent sets in order to predict behavior and trends), prescriptive analytics (techniques for identification of best alternatives for maximizing or minimizing business objectives). Students will learn how to use data effectively to drive rapid, precise, and profitable analytics-based decisions. The framework of using interlinked data-inputs, analytics models, and decision-support tools will be applied within a proprietary business analytics shell and demonstrated with examples from different functional areas of the enterprise. Prereq: AD100 Pre-Analytics Laboratory",0
MET,AD,571,Business Analytics Foundations,4,ONLINE,"This course presents fundamental knowledge and skills for applying business analytics to managerial decision-making in corporate environments. Topics include descriptive analytics (techniques for categorizing, characterizing, consolidation, and classifying data for conversion into useful information for the purposes of understanding and analyzing business performance), predictive analytics (techniques for detection of hidden patterns in large quantities of data to segment and group data into coherent sets in order to predict behavior and trends), prescriptive analytics (techniques for identification of best alternatives for maximizing or minimizing business objectives). Students will learn how to use data effectively to drive rapid, precise, and profitable analytics-based decisions. The framework of using interlinked data-inputs, analytics models, and decision-support tools will be applied within a proprietary business analytics shell and demonstrated with examples from different functional areas of the enterprise. Prereq: AD100 Pre-Analytics Laboratory",0
MET,AD,600,Economic Development and Tourism Management,4,IN_PERSON,"Provides a market oriented, strategic planning framework to address a broad range of tourism and regional economic and development issues that relate to tourism industry development and growth. The interplay of private, public and government organizations is discuss as they relate to the development of a comprehensive tourism plan. The combination of theory and practice will prepare students to analyze tourism markets, assess area, regional and national weakness and strengths as well as the security, infrastructure/logistics, marketing and costs associated tourism. Topics include: importance of tourism to the economy, developing the tourism strategy, ecotourism, research and analysis, positioning and marketing, funding tourism and developing new attractions.",0
MET,AD,603,Evaluating and Developing Markets for Cultural Tourism,4,IN_PERSON,"Cultural tourism in the 21st century is more than the traditional passive activities of visiting a museum, hearing a concert or strolling down an historic street. It has become an active, dynamic branch of tourism in which half of all tourists have stated that they want some cultural activities during their vacation. In this course we will introduce various themes of cultural tourism including the relationship between the Tourist Industry and the Cultural Heritage Manager, conservation and preservation vs. utilization of a cultural asset, authenticity vs. commoditization, stakeholders and what should be their rights and obligations, tangible and intangible tourist assets, the role of government, private industry and the non-profit sectors in tourism planning and sustainable economic development. We will examine these themes in different areas of cultural tourism including the art industry, historical sites, cultural landmarks, special events and festivals, theme parks and gastronomy.",0
MET,AD,605,Operations Management: Business Process Fundamentals,4,IN_PERSON,This course helps students to develop an understanding of the impact of business processes on the organization's performance and provides students the key tools to analyze and improve processes in both manufacturing and service sectors.,0
MET,AD,605,Operations Management: Business Process Fundamentals,4,ONLINE,This course helps students to develop an understanding of the impact of business processes on the organization's performance and provides students the key tools to analyze and improve processes in both manufacturing and service sectors.,0
MET,AD,610,Enterprise Risk Management,4,IN_PERSON,"This overview course examines the management issues involved with assessing the security and risk environments in both the private and public sectors in order to assure continuous system-wide operations. The course studies the elements of operational and technological risk assessment and operational continuity using a project management framework and quantitative risk metrics. Students are exposed to the role of the firm in crisis response and management as well as the terms, systems, and interactions necessary to assure continuous operations. Topics include: the role and need for comprehensive assurance strategy and planning; information security; an overview of the system-wide structure; the social and emotional impact on the workforce as well as its effect on productivity; and the organizational infrastructure relating to national, regional, and international compliance.",0
MET,AD,610,Enterprise Risk Management,4,ONLINE,"This overview course examines the management issues involved with assessing the security and risk environments in both the private and public sectors in order to assure continuous system-wide operations. The course studies the elements of operational and technological risk assessment and operational continuity using a project management framework and quantitative risk metrics. Students are exposed to the role of the firm in crisis response and management as well as the terms, systems, and interactions necessary to assure continuous operations. Topics include: the role and need for comprehensive assurance strategy and planning; information security; an overview of the system-wide structure; the social and emotional impact on the workforce as well as its effect on productivity; and the organizational infrastructure relating to national, regional, and international compliance.",0
MET,AD,612,COO-Public Emergency Management,4,ONLINE,"This course examines emergency management from national, state, local, and family perspectives of prevention, preparedness, response, and recovery. The course encompasses knowledge of the specific agencies, organizations, and individual behaviors in emergency management as well as the interlinking partnerships between/among these groups. Areas of discussion include: responsibilities at federal, state, community and individual levels; guidelines and procedures for operations and compliance such as the National response Plan; Incident Command Systems (ICS); exercises; plan development, command, and control; communication; partnership development and maintenance; leadership; and numerous other elements related to effective emergency management. The unique and critical roles of private and public partnerships are reviewed and particular attention is paid to the interplay and interdependency among national, state, community, business (public and private), and the individual.",0
MET,AD,613,Enterprise Risk Planning and Compliance,4,ONLINE,"Students are exposed to the important issues relating to corporate and organizational security and risk from both the perspective of systems designed to protect against disasters and aspects of emergency preparedness should systems fail. Security areas of study include information technology, terrorism, and other organization disruptions. Students study proactive risk assessment through management risk analysis techniques and simulations. Students will be able to design a company or agency global assurance plan, organize the strategy to make the plan operational, and implement control measures to assess the plan's degree of success. The course also provides explanations of legal/regulatory, auditing, and industry-specific requirements related to compliance, control, and reporting issue sin business risk management. The role of establishing and maintaining standards by local, national, and international agencies is discussed, as is the importance of these agencies in certifying operations.  Prereq: MET AD610.",0
MET,AD,614,Disaster Management,4,ONLINE,"This course takes concepts covered in MET AD 610 and MET AD 613 and applies them in more detail mainly to the corporate-private sector environment. During this course, we will first review the organization and processes necessary to effectively respond to and manage incidents, including the transition from emergency response and incident management to business recovery. Finally, the course will focus on disaster recovery, with an emphasis on technology recovery, an absolutely essential but sometimes overlooked component of any successful corporate recovery program. Prereq: MET AD610.",0
MET,AD,615,Introductory Macroeconomic Analysis,4,IN_PERSON,"Includes national economic performance; problems of recession, unemployment inflation, and trade and budget deficits; money creation, government spending, and taxation; economic policies for full employment and price stability; and international trade and payments.",0
MET,AD,616,Enterprise Risk Analytics,4,IN_PERSON,"The course offers an overview of the key current and emerging enterprise risk analytical approaches used by corporations and governmental institutions and is focused on understanding and implementing the enterprise risk management framework on how to leverage the opportunities around a firm to increase firm value. The major risk categories of the enterprise risk management such as financial risk, strategic risk and operational risk will be discussed and risk analytics approaches for each of these risks will be covered. Students will learn how to use interlinked data-inputs, analytics models, business statistics, optimization techniques, simulation, and decision-support tools. An integrated enterprise risk analytics approach will be demonstrated with examples from different functional areas of the enterprise. Prereq: METAD571",0
MET,AD,616,Enterprise Risk Analytics,4,ONLINE,"The course offers an overview of the key current and emerging enterprise risk analytical approaches used by corporations and governmental institutions and is focused on understanding and implementing the enterprise risk management framework on how to leverage the opportunities around a firm to increase firm value. The major risk categories of the enterprise risk management such as financial risk, strategic risk and operational risk will be discussed and risk analytics approaches for each of these risks will be covered. Students will learn how to use interlinked data-inputs, analytics models, business statistics, optimization techniques, simulation, and decision-support tools. An integrated enterprise risk analytics approach will be demonstrated with examples from different functional areas of the enterprise. Prereq: METAD571",0
MET,AD,617,Business Continuity Management,4,IN_PERSON,"The course presents, assesses, and discusses the contemporary theories, methods and practices related to business continuity (BC), business continuity management (BCM) and resiliency planning. The course incorporates the underpinnings of enterprise-wide risk management (ERM); however, it is designed to focus on broad-based threats, vulnerabilities, unexpected events, emergencies, and crises that may impacts organizations and their leaders and professionals. The course focuses on the design, development and applications of resilience, emergency planning, crisis management, BC, and disaster recovery used by organizations in the private sector. It presents a comprehensive, cutting-edge technologies pertaining BCM in complex organizations and challenging environments. Technological innovations are used to involve a complex array of high-level developments that result in transitions and transformations of businesses. Finally, the environmental considerations center on connections between business and the natural law.",0
MET,AD,617,Business Continuity Management,4,ONLINE,"The course presents, assesses, and discusses the contemporary theories, methods and practices related to business continuity (BC), business continuity management (BCM) and resiliency planning. The course incorporates the underpinnings of enterprise-wide risk management (ERM); however, it is designed to focus on broad-based threats, vulnerabilities, unexpected events, emergencies, and crises that may impacts organizations and their leaders and professionals. The course focuses on the design, development and applications of resilience, emergency planning, crisis management, BC, and disaster recovery used by organizations in the private sector. It presents a comprehensive, cutting-edge technologies pertaining BCM in complex organizations and challenging environments. Technological innovations are used to involve a complex array of high-level developments that result in transitions and transformations of businesses. Finally, the environmental considerations center on connections between business and the natural law.",0
MET,AD,630,Financial and Managerial Accounting,4,IN_PERSON,"Introduction to the concepts, methods, and problems of financial and managerial accounting. Includes data accumulation, accounting principles, financial statement analysis, measurement and disclosure issues, cost analysis, budgeting and control, production costs, and standard costs.",0
MET,AD,630,Financial and Managerial Accounting,4,ONLINE,"Introduction to the concepts, methods, and problems of financial and managerial accounting. Includes data accumulation, accounting principles, financial statement analysis, measurement and disclosure issues, cost analysis, budgeting and control, production costs, and standard costs.",0
MET,AD,632,Financial Concepts,4,IN_PERSON,"Introduction to the concepts, methods and problems of accounting and financial analysis. Includes accounting principles, measurement and disclosure issues, financial statement analysis, time value of money, cash flow projection and analysis, capital budgeting and project evaluation, bond and equity valuation, cost of capital and capital structure.",0
MET,AD,632,Financial Concepts,4,ONLINE,"Introduction to the concepts, methods and problems of accounting and financial analysis. Includes accounting principles, measurement and disclosure issues, financial statement analysis, time value of money, cash flow projection and analysis, capital budgeting and project evaluation, bond and equity valuation, cost of capital and capital structure.",0
MET,AD,642,Project Management,4,IN_PERSON,"The course explores modern project management by providing an enterprise-level, experiential view of the discipline focused on connecting projects to the organization's mission, vision, and values. The theme of the course is applying key project management tools and techniques, through case-based group work. Groups select, plan, report, and then present on their project's scope, schedule, cost, risk, quality, and communications elements using tools such as the WBS, network diagram, PERT estimate, Gantt chart (including the use of MS Project), risk register, and heat map. Students also gain familiarity with important new concepts in project management: Agile frameworks, sustainability thinking, and Benefits Realization Management, all of which will be important for their success not only in other graduate courses, but as they lead projects for their organizations. The course is aligned with the latest PMBOK? Guide from the Project Management Institute.",0
MET,AD,642,Project Management,4,ONLINE,"The course explores modern project management by providing an enterprise-level, experiential view of the discipline focused on connecting projects to the organization's mission, vision, and values. The theme of the course is applying key project management tools and techniques, through case-based group work. Groups select, plan, report, and then present on their project's scope, schedule, cost, risk, quality, and communications elements using tools such as the WBS, network diagram, PERT estimate, Gantt chart (including the use of MS Project), risk register, and heat map. Students also gain familiarity with important new concepts in project management: Agile frameworks, sustainability thinking, and Benefits Realization Management, all of which will be important for their success not only in other graduate courses, but as they lead projects for their organizations. The course is aligned with the latest PMBOK? Guide from the Project Management Institute.",0
MET,AD,643,Project Communications Management,4,IN_PERSON,"This course examines the behavioral aspects of working effectively in the project domain. We examine current philosophies of work around enhanced leadership, communication, conflict management, and negotiation skills, and the ability to organize, manage, and to produce efficient delivery from teams. Good leadership is an important element when applied to project management, and this course identifies various styles of communication and conflict resolution that leaders can use. The course also addresses more contemporary issues in PM, including resolving ambiguity and complexity, the use of improvised working styles, sustainable PM, and issues around power and politics within the project.",0
MET,AD,643,Project Communications Management,4,ONLINE,"This course examines the behavioral aspects of working effectively in the project domain. We examine current philosophies of work around enhanced leadership, communication, conflict management, and negotiation skills, and the ability to organize, manage, and to produce efficient delivery from teams. Good leadership is an important element when applied to project management, and this course identifies various styles of communication and conflict resolution that leaders can use. The course also addresses more contemporary issues in PM, including resolving ambiguity and complexity, the use of improvised working styles, sustainable PM, and issues around power and politics within the project.",0
MET,AD,644,Project Risk and Cost Management,4,IN_PERSON,"This course introduces students to macro and micro approaches to project cost estimation. Case studies of both pre-project and in- process estimating examine some of the more common perils of human irrationality associated with project estimation to help develop more sensible, achievable project outcomes. Students learn how to manage both project cost and schedule objectives throughout their projects using the Earned Value and Earned Schedule Measurement Systems. Students then study risk management through an examination of both individual and overall project risk and apply their learnings using advanced risk management software in an actual case study. Students also study project quality management, procurement/contract management, and project ethics and professional conduct using case study scenarios. Prereq: MET AD642",0
MET,AD,644,Project Risk and Cost Management,4,ONLINE,"This course introduces students to macro and micro approaches to project cost estimation. Case studies of both pre-project and in- process estimating examine some of the more common perils of human irrationality associated with project estimation to help develop more sensible, achievable project outcomes. Students learn how to manage both project cost and schedule objectives throughout their projects using the Earned Value and Earned Schedule Measurement Systems. Students then study risk management through an examination of both individual and overall project risk and apply their learnings using advanced risk management software in an actual case study. Students also study project quality management, procurement/contract management, and project ethics and professional conduct using case study scenarios. Prereq: MET AD642",0
MET,AD,646,Portfolio and Program Management,4,IN_PERSON,"Programs and projects deliver benefits to organizations by enhancing current capabilities or developing new capabilities for the organization to use. This course will provide a detailed understanding of program management and will present concepts that promote efficient and effective communication and coordination among various groups. Students will understand PMI? program management processes and use tools that automate and enforce processes for managing scope changes, risk, quality, issues, schedules, resources, releases, and costs. You will learn how to design a program and manage program costs, risk, and communication within the context of Project Portfolios. This course is targeted to senior executives, portfolio managers, program managers and their team members, members of a PMO, customers/stakeholders, educators, and consultants. This course introduces processes and knowledge areas from three new PMI standards: Program Management standard, OPM3, and Portfolio Management. Prereq: MET AD642",0
MET,AD,647,Project and Program Governance,4,ONLINE,"This is a comprehensive course on project and program monitoring, evaluation, and governance. Students will also understand enterprise wide-project interdependencies and determine the optimal pacing for a program to enable appropriate planning, scheduling, executing, monitoring, and controlling of the projects within a program in the future. It covers governance and evaluation methods that will be useful at various levels of large projects, including government and nonprofit organizations. This course will help project and program managers, analysts, consultants, educators, and managers in government, nonprofit, and private institutions to assess program results and identify ways to improve program performance. Other topics include: evaluation for small nonprofit organizations; assessing and improving planning, implementation and effectiveness; governance methodology and models; using evaluation tools and applications to assess factors linking projects under one program and provide the best allotment of resources between those projects; monitor complex, multi-project programs, and drill into current project details; enable collaboration and stakeholder alignment throughout a project life-cycle. Other topics include: creating a transparent and accountable organization with well-defined roles and one that is based on transparency, resource allocation and decision making and enterprise project management. Prereq: MET AD642",0
MET,AD,648,Ecommerce,4,IN_PERSON,"The course provides a detailed examination of the history of e-commerce, along with important concepts related to the ways that businesses can successfully use Internet and Web technology. Students are introduced to the concepts and problems associated with electronic commerce. Topics include comparison of e-commerce procedures, payment mechanisms, applications in different industry sectors, security, the challenges of starting and maintaining an electronic business site, as well as a comparison with traditional business practices. The development of a WordPress-themed website is a minor feature of the course. 4cr.",0
MET,AD,648,Ecommerce,4,ONLINE,"The course provides a detailed examination of the history of e-commerce, along with important concepts related to the ways that businesses can successfully use Internet and Web technology. Students are introduced to the concepts and problems associated with electronic commerce. Topics include comparison of e-commerce procedures, payment mechanisms, applications in different industry sectors, security, the challenges of starting and maintaining an electronic business site, as well as a comparison with traditional business practices. The development of a WordPress-themed website is a minor feature of the course. 4cr.",0
MET,AD,649,Agile Project Management,4,IN_PERSON,"The course provides an understanding of how new Agile principles and practices are changing the landscape of project management. The course is designed to give project managers fresh new insight into how to successfully blend Agile and traditional project management principles and practices in the right proportions to fit any business and project situation. The course provides a deep understanding of Agile project management principles and practices in order to see them as complementary rather than competitive to traditional project management. Topics include: Agile fundamentals, principles, and practices; roots of Agile in TQM and Lean Manufacturing; adapting an Agile approach to fit a business environment; planning and managing an enterprise-level Agile transformation; scaling agile to an enterprise level using enterprise-level Agile frameworks and Agile Project Management tools. Prereq: MET AD642",0
